[
  {
    "id": "anti-dmca",
    "name": "Anti DMCA",
    "description": "Обхід обмежень DMCA: прибирає або замінює заблоковані джерела у видачі.",
    "url": "https://levende.github.io/lampa-plugins/anti-dmca.js",
    "author": "@levende",
    "category": "video"
  },
  {
    "id": "avgrating",
    "name": "AVGRating",
    "description": "Відображення з 11 сайтів які працюють з рейтингами + нагороди + середня оцінка від всіх оцінок.\nПерелік: TMDB, IMDb, Rotten Tomatoes, Metacritic, Trakt TV, Lampa (CUB), RT Audience (Popcorn), MDBList Score, Letterboxd, Нагороди (Awards), Simkl.",
    "url": "https://cevamnelampaplagin.github.io/tytnemanichogodobrogo/avgrating.js",
    "author": "cevamnelampaplagin",
    "category": "theme"
  },
  {
    "id": "balancer-sanitizer",
    "name": "Balancer Sanitizer",
    "description": "Очищує та нормалізує URL-и балансерів джерел, прибираючи зайві параметри.",
    "url": "https://levende.github.io/lampa-plugins/balancer-sanitizer.js",
    "author": "@levende",
    "category": "other"
  },
  {
    "id": "bandera-2.0",
    "name": "Bandera 2.0",
    "description": "Плагін для перегляду онлайн джерел",
    "url": "https://lampame.github.io/main/bo.js",
    "author": "@lampame",
    "category": "video"
  },
  {
    "id": "bookmarks-sync",
    "name": "Bookmarks Sync",
    "description": "Синхронізує закладки та історію з сервісом CUB. Замінює локальні закладки даними з CUB.",
    "url": "https://levende.github.io/lampa-plugins/bookmarks-sync.js",
    "author": "@levende",
    "category": "other"
  },
  {
    "id": "buttons",
    "name": "Buttons+",
    "description": "Кастомізація кнопок у картці. Візуальний редактор дозволяє змінювати порядок, ховати зайві, обирати вигляд (іконки чи текст) і групувати їх у власні папки. Доступно понад 60 іконок, ручний підбір кольорів (палітра/HEX) та розумне фарбування контурних і багатоколірних значків.",
    "url": "https://ko31k.github.io/LMP/plugins/buttons+.js",
    "author": "@K031k",
    "category": "other"
  },
  {
    "id": "cardify",
    "name": "Cardify+",
    "description": "Модифікація плагіну для інтерфейсу повної картки (від @ipavlin98 та @Yaroslav_Films). Замінює статичний фон у картці фільму чи серіалу на динамічний. Вміє автоматично відтворювати трейлер на фоні (без звуку) або показувати плавне слайдшоу з постерів, якщо відео вимкнено.",
    "url": "https://ko31k.github.io/LMP/plugins/cardify+.js",
    "author": "@K031k",
    "category": "theme"
  },
  {
    "id": "community-watches",
    "name": "CommunityWatches",
    "description": "Контент-лайни Community Watches: «Топ тижня» та «Сховані геми» для головної, фільмів і серіалів. Кешує результати.",
    "url": "https://lampame.github.io/main/cw.js",
    "author": "Lampa Movie Enhancer",
    "category": "collections",
    "siaivo": true
  },
  {
    "id": "concert-search",
    "name": "Concert Torr Search",
    "description": "Спеціалізований плагін для пошуку концертів і музичних релізів у підключених торрент-джерелах. Дає швидкий вхід у тематичний пошук без ручних фільтрів.",
    "url": "https://lampame.github.io/main/cts.js",
    "author": "Lampa Movie Enhancer",
    "category": "video"
  },
  {
    "id": "custom-favs",
    "name": "Custom Favorites",
    "description": "Розширює закладки Lampa користувацькими типами для зручнішої організації контенту.",
    "url": "https://levende.github.io/lampa-plugins/custom-favs.js",
    "author": "@levende",
    "category": "other"
  },
  {
    "id": "EpWatch",
    "name": "EpWatch",
    "description": "Стежить за новими серіями ваших улюблених серіалів і надсилає сповіщення в Telegram",
    "url": "http://lampaua.mooo.com/epwatch.js",
    "author": "@bazarnetua",
    "category": "other"
  },
  {
    "id": "history-filter",
    "name": "History Filter",
    "description": "Фільтрування та видалення елементів з історії перегляду за різними критеріями.",
    "url": "https://levende.github.io/lampa-plugins/history-filter.js",
    "author": "@levende",
    "category": "other"
  },
  {
    "id": "imdb-trailers",
    "name": "IMDb Trailers",
    "description": "Трендові трейлери з IMDb: горизонтальна лінія на головній, повноекранний режим з пагінацією та вибором якості.",
    "url": "https://lampame.github.io/main/timdb.js",
    "author": "Lampa Movie Enhancer",
    "category": "video"
  },
  {
    "id": "infuse-save",
    "name": "Infuse Save",
    "description": "Додає дії Save to Infuse та Save all to Infuse у список торрент-файлів. Приводить посилання до сумісного формату і передає їх в Infuse через deeplink.",
    "url": "https://lampame.github.io/main/infuseSave.js",
    "author": "@lampame",
    "category": "other"
  },
  {
    "id": "interface",
    "name": "Interface+",
    "description": "Комплексний плагін інтерфейсу: теми оформлення, нова інфо-панель, кольорові рейтинги, вікові мітки й статуси. Додає оригінальну назву, альтернативні найближчі епізоди, гнучке налаштування бейджів на картках та оновлений блок торентів із кольоровими акцентами для сидів і бітрейту.",
    "url": "https://ko31k.github.io/LMP/plugins/interface+.js",
    "author": "@K031k",
    "category": "theme"
  },
  {
    "id": "lampac-src-filter",
    "name": "Lampac Source Filter",
    "description": "Фільтрує джерела Lampac, дозволяючи приховати небажані провайдери з видачі.",
    "url": "https://levende.github.io/lampa-plugins/lampac-src-filter.js",
    "author": "@levende",
    "category": "video"
  },
  {
    "id": "lnum",
    "name": "LNUM",
    "description": "Додає каталог LNum як додаткове джерело контенту",
    "url": "https://levende.github.io/lampa-plugins/lnum.js",
    "author": "@levende",
    "category": "collections"
  },
  {
    "id": "lparty",
    "name": "LParty",
    "description": "Плагін який дозволяє дивитися одне й те саме синхронно з друзями на різних пристроях.",
    "url": "https://nrsua.github.io/lampa-nrs/lparty.js",
    "author": "@nrsua, @levende",
    "category": "other"
  },
  {
    "id": "movie-enhancer",
    "name": "Movie Enhancer",
    "description": "Модуль покращень інтерфейсу картки: редактор кнопок, режим іконок, додаткові рейтинги (MDBList/Streaming Discovery), перемикач джерел у шапці, англомовні метадані, якість та тривалість серій.",
    "url": "https://lampame.github.io/main/lme.js",
    "author": "Lampa Movie Enhancer",
    "category": "theme"
  },
  {
    "id": "netflix",
    "name": "Netflix",
    "description": "Перетворює головну сторінку на інтерфейс, дуже схожий на Netflix.",
    "url": "https://adambenhassen.github.io/netflix.js",
    "author": "@adambenhassen",
    "category": "theme"
  },
  {
    "id": "networks",
    "name": "Networks",
    "description": "Мод плагіну від @levende. Додає в картку кнопки стримінгів, де виходили проекти, та виробничих студій. Є можливість налаштування відступів, розмірів і центрування на смартфонах.\nНалаштування: Параметри → Інтерфейс → Платформи та студії.",
    "url": "https://ko31k.github.io/LMP/plugins/Networks.js",
    "author": "@K031k",
    "category": "theme"
  },
  {
    "id": "new-category",
    "name": "New Category",
    "description": "Розширює каталог Lampa новими категоріями (кіно, TV Top/New, концерти, документальні тощо), добірками за стримінговими мережами та країнами, а також системою закладок.",
    "url": "https://lampame.github.io/main/newcategory.js",
    "author": "Lampa Movie Enhancer",
    "category": "collections"
  },
  {
    "id": "nightingale",
    "name": "Nightingale",
    "description": "Додає на картки бейдж з прапором України, якщо WH API підтверджує наявність українського перекладу в Онлайн-джерелах.",
    "url": "https://lampame.github.io/main/n.js",
    "author": "Lampa Movie Enhancer",
    "category": "theme"
  },
  {
    "id": "nightingale-notifications",
    "name": "NightingaleNotifications",
    "description": "Канал сповіщень Nightingale: підписка на серіали через дзвоник у картці, екран підписок, UID sync, автоімпорт з Lampa/TraktTV.",
    "url": "https://lampame.github.io/main/nn.js",
    "author": "Lampa Movie Enhancer",
    "category": "other"
  },
  {
    "id": "parsers",
    "name": "Parsers",
    "description": "Каталог парсерів з індикацією доступності та швидким вибором без ручного вводу.\nДозволяє вибрати основний, та при потребі додатковий парсер зі списку, чи додати в список власний/змінити існуючий.",
    "url": "https://ko31k.github.io/LMP/plugins/Parsers.js",
    "author": "@K031k",
    "category": "other"
  },
  {
    "id": "pipfs",
    "name": "pipfs",
    "description": "Дає можливість дивитись відео у вікні вбудованого плеєра лампи. \"Враховано\" перекривання навігаційного бара на мобільному, підтримка субтитрів у вікні (може багати але це не точно).",
    "url": "https://cevamnelampaplagin.github.io/sharewithothers/pipfs.js",
    "author": "@nameoftelegr",
    "category": "other"
  },
  {
    "id": "profiles",
    "name": "Profiles",
    "description": "Керування профілями в Lampa без CUB: незалежні профілі з налаштуваннями, м'яке перемикання, інтеграція з Lampac.",
    "url": "https://levende.github.io/lampa-plugins/profiles.js",
    "author": "@levende",
    "category": "other"
  },
  {
    "id": "radio",
    "name": "Radio",
    "description": "Плагін «Radio» для Lampa додає в меню розділ з понад 50 радіостанціями (українські та світові).",
    "url": "https://ne3nayskas.github.io/plugins/radio.js",
    "author": "@ne3nayskas",
    "category": "radio"
  },
  {
    "id": "random-scheduled",
    "name": "Random Scheduled",
    "description": "Випадковий вибір контенту із запланованого/відкладеного списку для перегляду.",
    "url": "https://levende.github.io/lampa-plugins/random-scheduled.js",
    "author": "@levende",
    "category": "collections"
  },
  {
    "id": "remote-keyboard",
    "name": "Remote Keyboard",
    "description": "**Remote Keyboard**\nЗручний пульт. QR-підключення, тачпад, клавіатура та системні кнопки.",
    "url": "https://kinohub.uk/remotekeyboard.js",